<?xml version="1.0" encoding="utf-8"?>
<Level xmlns:xsi="http://www.w3.org/2001/XMLSchema-instance" xmlns:xsd="http://www.w3.org/2001/XMLSchema" xsi:noNamespaceSchemaLocation="../Level.xsd" background="Black.png">
  <difficulty>hard</difficulty>
  <description>8th letter of the greek alphabet</description>
  <randomWaveCount>20</randomWaveCount>
  <Waves />
  <Spawners>
    <Spawner spawnX="0.5" spawnY="0" />
    <Spawner spawnX="-0.5" spawnY="0" />
  </Spawners>
  <PathSegments>
    <Segment startX="0.5" startY="0" endX="4" endY="0" />
    <Segment startX="4" startY="0" endX="4" endY="4" />
    <Segment startX="4" startY="4" endX="3" endY="4" />
    <Segment startX="3" startY="4" endX="3" endY="6" />
    <Segment startX="3" startY="6" endX="2" endY="6" />
    <Segment startX="2" startY="6" endX="2" endY="8" />
    <Segment startX="2" startY="8" endX="0" endY="8" />
    <Segment startX="4" startY="0" endX="4" endY="-4" />
    <Segment startX="4" startY="-4" endX="3" endY="-4" />
    <Segment startX="3" startY="-4" endX="3" endY="-6" />
    <Segment startX="3" startY="-6" endX="2" endY="-6" />
    <Segment startX="2" startY="-6" endX="2" endY="-8" />
    <Segment startX="2" startY="-8" endX="0" endY="-8" />
    <Segment startX="-0.5" startY="0" endX="-4" endY="0" />
    <Segment startX="-4" startY="0" endX="-4" endY="4" />
    <Segment startX="-4" startY="4" endX="-3" endY="4" />
    <Segment startX="-3" startY="4" endX="-3" endY="6" />
    <Segment startX="-3" startY="6" endX="-2" endY="6" />
    <Segment startX="-2" startY="6" endX="-2" endY="8" />
    <Segment startX="-2" startY="8" endX="0" endY="8" />
    <Segment startX="-4" startY="0" endX="-4" endY="-4" />
    <Segment startX="-4" startY="-4" endX="-3" endY="-4" />
    <Segment startX="-3" startY="-4" endX="-3" endY="-6" />
    <Segment startX="-3" startY="-6" endX="-2" endY="-6" />
    <Segment startX="-2" startY="-6" endX="-2" endY="-8" />
    <Segment startX="-2" startY="-8" endX="0" endY="-8" />
  </PathSegments>
  <Towers>
    <Tower name="Sniper Tower" x="0" y="0">
      <Upgrades>
        <Upgrade Name="Heavy Upgrade" Count="1" />
        <Upgrade Name="Spitfire Upgrade" Count="1" />
        <Upgrade Name="Manual Control" Count="1" />
      </Upgrades>
    </Tower>
  </Towers>
  <shuffleDeck>true</shuffleDeck>
  <levelDeck name="Theta Deck">
    <Cards>
      <Card name="Basic Tower" count="6" />
      <Card name="Basic Upgrade" count="4" />
      <Card name="Enrage" count="2" />
      <Card name="Fast Tower" count="8" />
      <Card name="Fast Upgrade" count="8" />
      <Card name="Heavy Tower" count="4" />
      <Card name="Heavy Upgrade" count="4" />
      <Card name="Infrastructure Funding" count="5" />
      <Card name="Light Shield" count="3" />
      <Card name="Reinforce" count="2" />
      <Card name="Scavenge" count="3" />
      <Card name="Summon Swarm" count="1" />
    </Cards>
  </levelDeck>
</Level>