<?xml version="1.0" encoding="utf-8"?>
<Level xmlns:xsi="http://www.w3.org/2001/XMLSchema-instance" xmlns:xsd="http://www.w3.org/2001/XMLSchema" xsi:noNamespaceSchemaLocation="../Level.xsd" background="Black.png">
  <difficulty>hard</difficulty>
  <description>A very challenging map with 18 points to defend</description>
  <randomWaveCount>20</randomWaveCount>
  <waveGrowthAbsolute>30</waveGrowthAbsolute>
  <waveGrowthLinear>6</waveGrowthLinear>
  <waveGrowthSquared>2</waveGrowthSquared>
  <waveGrowthExponential>1</waveGrowthExponential>
  <waveTimeLinear>1</waveTimeLinear>
  <Waves />
  <Spawners>
    <Spawner spawnX="10" spawnY="0" />
  </Spawners>
  <PathSegments>
    <Segment startX="10" startY="0" endX="6" endY="0" />
    <Segment startX="6" startY="0" endX="6" endY="4" />
    <Segment startX="6" startY="0" endX="4" endY="0" />
    <Segment startX="4" startY="0" endX="4" endY="4" />
    <Segment startX="4" startY="0" endX="2" endY="0" />
    <Segment startX="2" startY="0" endX="2" endY="4" />
    <Segment startX="2" startY="0" endX="0" endY="0" />
    <Segment startX="0" startY="0" endX="0" endY="4" />
    <Segment startX="0" startY="0" endX="-2" endY="0" />
    <Segment startX="-2" startY="0" endX="-2" endY="4" />
    <Segment startX="-2" startY="0" endX="-4" endY="0" />
    <Segment startX="-4" startY="0" endX="-4" endY="4" />
    <Segment startX="-4" startY="0" endX="-6" endY="0" />
    <Segment startX="-6" startY="0" endX="-6" endY="4" />
    <Segment startX="-6" startY="0" endX="-8" endY="0" />
    <Segment startX="-8" startY="0" endX="-8" endY="4" />
    <Segment startX="-8" startY="0" endX="-10" endY="0" />
    <Segment startX="-10" startY="0" endX="-10" endY="4" />
    <Segment startX="6" startY="0" endX="6" endY="-4" />
    <Segment startX="4" startY="0" endX="4" endY="-4" />
    <Segment startX="2" startY="0" endX="2" endY="-4" />
    <Segment startX="0" startY="0" endX="0" endY="-4" />
    <Segment startX="-2" startY="0" endX="-2" endY="-4" />
    <Segment startX="-4" startY="0" endX="-4" endY="-4" />
    <Segment startX="-6" startY="0" endX="-6" endY="-4" />
    <Segment startX="-8" startY="0" endX="-8" endY="-4" />
    <Segment startX="-10" startY="0" endX="-10" endY="-4" />
  </PathSegments>
  <Towers />
  <shuffleDeck>true</shuffleDeck>
  <premadeDeckName>Endurance</premadeDeckName>
</Level>