<?xml version="1.0" encoding="utf-8"?>
<Level xmlns:xsi="http://www.w3.org/2001/XMLSchema-instance" xmlns:xsd="http://www.w3.org/2001/XMLSchema" xsi:noNamespaceSchemaLocation="../Level.xsd"  background="Blue_Gradient.png" backgroundTileRate="64" >
  <difficulty>medium</difficulty>
  <description>Two symmetrical spirals.  The default level deck here contains no towers.</description>
  <randomWaveCount>19</randomWaveCount>
  <Waves>
    <Wave type="Standard" budget="116" time="1.1" />
  </Waves>
  <Spawners>
    <Spawner spawnX="0" spawnY="-0.5" />
    <Spawner spawnX="0" spawnY="0.5" />
  </Spawners>
  <PathSegments>
    <Segment startX="0" startY="-0.5" endX="0" endY="-1.5" />
    <Segment startX="0" startY="-1.5" endX="2" endY="-1.5" />
    <Segment startX="2" startY="-1.5" endX="2" endY="2.5" />
    <Segment startX="2" startY="2.5" endX="-8" endY="2.5" />
    <Segment startX="-8" startY="2.5" endX="-8" endY="-2.5" />
    <Segment startX="-8" startY="-2.5" endX="-4" endY="-2.5" />
    <Segment startX="-4" startY="-2.5" endX="-4" endY="1.5" />
    <Segment startX="-4" startY="1.5" endX="-7" endY="1.5" />
    <Segment startX="-7" startY="1.5" endX="-7" endY="-1.5" />
    <Segment startX="-7" startY="-1.5" endX="-5" endY="-1.5" />
    <Segment startX="-5" startY="-1.5" endX="-5" endY="0.5" />
    <Segment startX="-5" startY="0.5" endX="-6" endY="0.5" />
    <Segment startX="0" startY="0.5" endX="0" endY="1.5" />
    <Segment startX="0" startY="1.5" endX="-2" endY="1.5" />
    <Segment startX="-2" startY="1.5" endX="-2" endY="-2.5" />
    <Segment startX="-2" startY="-2.5" endX="8" endY="-2.5" />
    <Segment startX="8" startY="-2.5" endX="8" endY="2.5" />
    <Segment startX="8" startY="2.5" endX="4" endY="2.5" />
    <Segment startX="4" startY="2.5" endX="4" endY="-1.5" />
    <Segment startX="4" startY="-1.5" endX="7" endY="-1.5" />
    <Segment startX="7" startY="-1.5" endX="7" endY="1.5" />
    <Segment startX="7" startY="1.5" endX="5" endY="1.5" />
    <Segment startX="5" startY="1.5" endX="5" endY="-0.5" />
    <Segment startX="5" startY="-0.5" endX="6" endY="-0.5" />
  </PathSegments>
  <Towers>
    <Tower name="Heavy Tower" x="-6.5" y="0" />
    <Tower name="Heavy Tower" x="-5.5" y="0" />
    <Tower name="Heavy Tower" x="-6.5" y="-1" />
    <Tower name="Heavy Tower" x="-5.5" y="-1" />
    <Tower name="Fast Tower" x="-6.5" y="-0.5" />
    <Tower name="Fast Tower" x="-6" y="0" />
    <Tower name="Fast Tower" x="-6" y="-1" />
    <Tower name="Fast Tower" x="-5.5" y="-0.5" />
    <Tower name="Basic Tower" x="-6" y="-0.5" />
    <Tower name="Heavy Tower" x="6.5" y="1" />
    <Tower name="Heavy Tower" x="5.5" y="1" />
    <Tower name="Heavy Tower" x="6.5" y="0" />
    <Tower name="Heavy Tower" x="5.5" y="0" />
    <Tower name="Fast Tower" x="6.5" y="0.5" />
    <Tower name="Fast Tower" x="6" y="1" />
    <Tower name="Fast Tower" x="6" y="0" />
    <Tower name="Fast Tower" x="5.5" y="0.5" />
    <Tower name="Basic Tower" x="6" y="0.5" />
  </Towers>
  <shuffleDeck>true</shuffleDeck>
  <levelDeck name="Level Deck">
    <Cards>
      <Card name="Enrage" count="4" />
      <Card name="Fast Upgrade" count="10" />
      <Card name="Heavy Upgrade" count="10" />
      <Card name="Recycle" count="3" />
      <Card name="Shield" count="3" />
    </Cards>
  </levelDeck>
</Level>