<?xml version="1.0" encoding="utf-8"?>
<Level xmlns:xsi="http://www.w3.org/2001/XMLSchema-instance" xmlns:xsd="http://www.w3.org/2001/XMLSchema" xsi:noNamespaceSchemaLocation="../Level.xsd" background="Black.png">
  <difficulty>hard</difficulty>
  <description>A challenging map with nine paths to defend</description>
  <randomWaveCount>15</randomWaveCount>
  <waveGrowthAbsolute>30</waveGrowthAbsolute>
  <waveGrowthLinear>6</waveGrowthLinear>
  <waveGrowthSquared>2</waveGrowthSquared>
  <waveGrowthExponential>1</waveGrowthExponential>
  <waveTimeLinear>1</waveTimeLinear>
  <Waves />
  <Spawners>
    <Spawner spawnX="-5" spawnY="-5" />
    <Spawner spawnX="-3" spawnY="-5" />
    <Spawner spawnX="-1" spawnY="-5" />
    <Spawner spawnX="1" spawnY="-5" />
    <Spawner spawnX="3" spawnY="-5" />
    <Spawner spawnX="-5" spawnY="-3" />
    <Spawner spawnX="-5" spawnY="-1" />
    <Spawner spawnX="-5" spawnY="1" />
    <Spawner spawnX="-5" spawnY="3" />
  </Spawners>
  <PathSegments>
    <Segment startX="-5" startY="-5" endX="5" endY="5" />
    <Segment startX="-3" startY="-5" endX="5" endY="3" />
    <Segment startX="-1" startY="-5" endX="5" endY="1" />
    <Segment startX="1" startY="-5" endX="5" endY="-1" />
    <Segment startX="3" startY="-5" endX="5" endY="-3" />
    <Segment startX="-5" startY="-3" endX="3" endY="5" />
    <Segment startX="-5" startY="-1" endX="1" endY="5" />
    <Segment startX="-5" startY="1" endX="-1" endY="5" />
    <Segment startX="-5" startY="3" endX="-3" endY="5" />
  </PathSegments>
  <Towers>
    <Tower name="Fast Tower" x="5" y="-5">
      <Upgrades>
        <Upgrade Name="Fast Upgrade" Count="3" />
      </Upgrades>
    </Tower>
    <Tower name="Fast Tower" x="-5" y="5">
      <Upgrades>
        <Upgrade Name="Fast Upgrade" Count="3" />
      </Upgrades>
    </Tower>
  </Towers>
  <shuffleDeck>true</shuffleDeck>
  <levelDeck name="New Deck">
    <Cards>
      <Card name="Basic Tower" count="5" />
      <Card name="Basic Upgrade" count="5" />
      <Card name="Double-Barrel Upgrade" count="5" />
      <Card name="Fast Tower" count="5" />
      <Card name="Fast Upgrade" count="5" />
      <Card name="Light Shield" count="5" />
      <Card name="Piercing Ammo" count="5" />
      <Card name="Risky Draw" count="5" />
    </Cards>
  </levelDeck>
</Level>