<?xml version="1.0" encoding="utf-8"?>
<Level xmlns:xsi="http://www.w3.org/2001/XMLSchema-instance" xmlns:xsd="http://www.w3.org/2001/XMLSchema" xsi:noNamespaceSchemaLocation="../Level.xsd" background="Blue_Gradient.png" backgroundTileRate="64" >
  <difficulty>medium</difficulty>
  <description>Two paths weaving through each other.</description>
  <randomWaveCount>25</randomWaveCount>
  <Waves />
  <Spawners>
    <Spawner spawnX="21" spawnY="-3" />
    <Spawner spawnX="-2" spawnY="2" />
  </Spawners>
  <PathSegments>
    <Segment startX="21" startY="-3" endX="19" endY="-3" />
    <Segment startX="19" startY="-3" endX="19" endY="3" />
    <Segment startX="19" startY="3" endX="10" endY="3" />
    <Segment startX="10" startY="3" endX="10" endY="-3" />
    <Segment startX="10" startY="-3" endX="1" endY="-3" />
    <Segment startX="1" startY="-3" endX="1" endY="3" />
    <Segment startX="1" startY="3" endX="-1" endY="3" />
    <Segment startX="-2" startY="2" endX="-2" endY="0" />
    <Segment startX="-2" startY="0" endX="4" endY="0" />
    <Segment startX="4" startY="0" endX="4" endY="-6" />
    <Segment startX="4" startY="-6" endX="7" endY="-6" />
    <Segment startX="7" startY="-6" endX="7" endY="0" />
    <Segment startX="7" startY="0" endX="13" endY="0" />
    <Segment startX="13" startY="0" endX="13" endY="6" />
    <Segment startX="13" startY="6" endX="16" endY="6" />
    <Segment startX="16" startY="6" endX="16" endY="0" />
    <Segment startX="16" startY="0" endX="22" endY="0" />
    <Segment startX="22" startY="0" endX="22" endY="-2" />
  </PathSegments>
  <Towers />
  <shuffleDeck>true</shuffleDeck>
  <premadeDeckName>Plague</premadeDeckName>
</Level>