<?xml version="1.0" encoding="utf-8"?>
<Level xmlns:xsi="http://www.w3.org/2001/XMLSchema-instance" xmlns:xsd="http://www.w3.org/2001/XMLSchema" xsi:noNamespaceSchemaLocation="../Level.xsd" background="Black.png">
  <difficulty>medium</difficulty>
  <description>A region with many branching paths</description>
  <randomWaveCount>30</randomWaveCount>
  <Waves />
  <Spawners>
    <Spawner spawnX="7" spawnY="-5.5" />
    <Spawner spawnX="1" spawnY="-5.5" />
  </Spawners>
  <PathSegments>
    <Segment startX="7" startY="-5.5" endX="7" endY="-4.5" />
    <Segment startX="7" startY="-4.5" endX="8" endY="-4.5" />
    <Segment startX="8" startY="-4.5" endX="8" endY="2.5" />
    <Segment startX="8" startY="2.5" endX="7" endY="3.5" />
    <Segment startX="7" startY="3.5" endX="7" endY="5.5" />
    <Segment startX="7" startY="5.5" endX="5" endY="5.5" />
    <Segment startX="5" startY="5.5" endX="5" endY="3.5" />
    <Segment startX="5" startY="3.5" endX="5" endY="2.5" />
    <Segment startX="5" startY="2.5" endX="3" endY="2.5" />
    <Segment startX="3" startY="2.5" endX="2" endY="3.5" />
    <Segment startX="7" startY="3.5" endX="5" endY="3.5" />
    <Segment startX="5" startY="2.5" endX="5" endY="0.5" />
    <Segment startX="5" startY="0.5" endX="3" endY="0.5" />
    <Segment startX="3" startY="0.5" endX="3" endY="2.5" />
    <Segment startX="7" startY="-4.5" endX="5" endY="-2.5" />
    <Segment startX="5" startY="-2.5" endX="5" endY="0.5" />
    <Segment startX="2" startY="3.5" endX="2" endY="4.5" />
    <Segment startX="2" startY="4.5" endX="0" endY="4.5" />
    <Segment startX="0" startY="4.5" endX="0" endY="1.5" />
    <Segment startX="0" startY="1.5" endX="-1" endY="0.5" />
    <Segment startX="-1" startY="0.5" endX="-3" endY="0.5" />
    <Segment startX="-1" startY="0.5" endX="-1" endY="-2.5" />
    <Segment startX="1" startY="-2.5" endX="-1" endY="-2.5" />
    <Segment startX="-1" startY="-2.5" endX="-1" endY="-3.5" />
    <Segment startX="-1" startY="-3.5" endX="-2" endY="-4.5" />
    <Segment startX="-2" startY="-4.5" endX="-3" endY="-4.5" />
    <Segment startX="-3" startY="-4.5" endX="-4" endY="-3.5" />
    <Segment startX="-4" startY="-3.5" endX="-4" endY="0.5" />
    <Segment startX="-4" startY="0.5" endX="-4" endY="1.5" />
    <Segment startX="-4" startY="1.5" endX="-6" endY="1.5" />
    <Segment startX="-6" startY="1.5" endX="-8" endY="1.5" />
    <Segment startX="-8" startY="1.5" endX="-8" endY="-1.5" />
    <Segment startX="-8" startY="-1.5" endX="-6" endY="-3.5" />
    <Segment startX="-6" startY="-3.5" endX="-6" endY="-5.5" />
    <Segment startX="-4" startY="1.5" endX="-4" endY="3.5" />
    <Segment startX="-4" startY="3.5" endX="-6" endY="3.5" />
    <Segment startX="-6" startY="3.5" endX="-6" endY="1.5" />
    <Segment startX="1" startY="-5.5" endX="1" endY="-4.5" />
    <Segment startX="1" startY="-4.5" endX="3" endY="-4.5" />
    <Segment startX="3" startY="-4.5" endX="5" endY="-2.5" />
    <Segment startX="1" startY="-4.5" endX="1" endY="-2.5" />
    <Segment startX="-3" startY="0.5" endX="-4" endY="0.5" />
  </PathSegments>
  <Towers />
  <shuffleDeck>true</shuffleDeck>
  <premadeDeckName>Endurance</premadeDeckName>
</Level>