<?xml version="1.0" encoding="utf-8"?>
<Level xmlns:xsi="http://www.w3.org/2001/XMLSchema-instance" xmlns:xsd="http://www.w3.org/2001/XMLSchema" xsi:noNamespaceSchemaLocation="../Level.xsd" background="Multicolor_Arcs.png" backgroundTileRate="32" centerBackground="true">
  <difficulty>medium</difficulty>
  <description>Enemies climbing the pile.</description>
  <randomWaveCount>20</randomWaveCount>
  <waveGrowthLinear>5</waveGrowthLinear>
  <waveGrowthSquared>2.4</waveGrowthSquared>
  <waveTimeLinear>1.3</waveTimeLinear>
  <waveTimeMax>25</waveTimeMax>
  <Waves />
  <Spawners>
    <Spawner spawnX="-6" spawnY="-8.5" />
    <Spawner spawnX="-6" spawnY="-8.5" />
    <Spawner spawnX="-6" spawnY="-8.5" />
    <Spawner spawnX="-2" spawnY="-8.5" />
    <Spawner spawnX="-2" spawnY="-8.5" />
    <Spawner spawnX="-2" spawnY="-8.5" />
    <Spawner spawnX="2" spawnY="-8.5" />
    <Spawner spawnX="2" spawnY="-8.5" />
    <Spawner spawnX="2" spawnY="-8.5" />
    <Spawner spawnX="6" spawnY="-8.5" />
    <Spawner spawnX="6" spawnY="-8.5" />
    <Spawner spawnX="6" spawnY="-8.5" />
  </Spawners>
  <PathSegments>
    <Segment startX="-6" startY="-8.5" endX="-8" endY="-7.5" />
    <Segment startX="-8" startY="-7.5" endX="-8" endY="-4.5" />
    <Segment startX="-8" startY="-4.5" endX="-6" endY="-3.5" />
    <Segment startX="-6" startY="-8.5" endX="-4" endY="-7.5" />
    <Segment startX="-4" startY="-7.5" endX="-4" endY="-4.5" />
    <Segment startX="-4" startY="-4.5" endX="-6" endY="-3.5" />
    <Segment startX="-6" startY="-8.5" endX="-6" endY="-5.5" />
    <Segment startX="-6" startY="-5.5" endX="-4" endY="-4.5" />
    <Segment startX="-6" startY="-5.5" endX="-8" endY="-4.5" />
    <Segment startX="-2" startY="-8.5" endX="-4" endY="-7.5" />
    <Segment startX="-4" startY="-7.5" endX="-4" endY="-4.5" />
    <Segment startX="-4" startY="-4.5" endX="-2" endY="-3.5" />
    <Segment startX="-2" startY="-8.5" endX="0" endY="-7.5" />
    <Segment startX="0" startY="-7.5" endX="0" endY="-4.5" />
    <Segment startX="0" startY="-4.5" endX="-2" endY="-3.5" />
    <Segment startX="-2" startY="-8.5" endX="-2" endY="-5.5" />
    <Segment startX="-2" startY="-5.5" endX="-4" endY="-4.5" />
    <Segment startX="-2" startY="-5.5" endX="0" endY="-4.5" />
    <Segment startX="2" startY="-8.5" endX="0" endY="-7.5" />
    <Segment startX="0" startY="-4.5" endX="2" endY="-3.5" />
    <Segment startX="2" startY="-8.5" endX="4" endY="-7.5" />
    <Segment startX="4" startY="-7.5" endX="4" endY="-4.5" />
    <Segment startX="4" startY="-4.5" endX="2" endY="-3.5" />
    <Segment startX="2" startY="-8.5" endX="2" endY="-5.5" />
    <Segment startX="2" startY="-5.5" endX="0" endY="-4.5" />
    <Segment startX="2" startY="-5.5" endX="4" endY="-4.5" />
    <Segment startX="-6" startY="-3.5" endX="-6" endY="-0.5" />
    <Segment startX="-6" startY="-0.5" endX="-4" endY="0.5" />
    <Segment startX="-4" startY="0.5" endX="-4" endY="3.5" />
    <Segment startX="-4" startY="3.5" endX="-2" endY="4.5" />
    <Segment startX="2" startY="-3.5" endX="2" endY="-0.5" />
    <Segment startX="2" startY="-0.5" endX="0" endY="0.5" />
    <Segment startX="0" startY="0.5" endX="0" endY="3.5" />
    <Segment startX="0" startY="3.5" endX="-2" endY="4.5" />
    <Segment startX="0" startY="-4.5" endX="0" endY="-1.5" />
    <Segment startX="0" startY="-1.5" endX="-2" endY="-0.5" />
    <Segment startX="-2" startY="-0.5" endX="-2" endY="2.5" />
    <Segment startX="-2" startY="2.5" endX="-4" endY="3.5" />
    <Segment startX="0" startY="-1.5" endX="2" endY="-0.5" />
    <Segment startX="-2" startY="-0.5" endX="0" endY="0.5" />
    <Segment startX="-2" startY="2.5" endX="0" endY="3.5" />
    <Segment startX="-4" startY="-4.5" endX="-4" endY="-1.5" />
    <Segment startX="-4" startY="-1.5" endX="-6" endY="-0.5" />
    <Segment startX="-4" startY="-1.5" endX="-2" endY="-0.5" />
    <Segment startX="-2" startY="-0.5" endX="-4" endY="0.5" />
    <Segment startX="-2" startY="-3.5" endX="-2" endY="-0.5" />
    <Segment startX="6" startY="-8.5" endX="8" endY="-7.5" />
    <Segment startX="8" startY="-7.5" endX="8" endY="-4.5" />
    <Segment startX="8" startY="-4.5" endX="6" endY="-3.5" />
    <Segment startX="6" startY="-3.5" endX="6" endY="-0.5" />
    <Segment startX="6" startY="-0.5" endX="4" endY="0.5" />
    <Segment startX="4" startY="0.5" endX="4" endY="3.5" />
    <Segment startX="4" startY="3.5" endX="2" endY="4.5" />
    <Segment startX="6" startY="-8.5" endX="6" endY="-5.5" />
    <Segment startX="6" startY="-5.5" endX="4" endY="-4.5" />
    <Segment startX="4" startY="-4.5" endX="4" endY="-1.5" />
    <Segment startX="4" startY="-1.5" endX="2" endY="-0.5" />
    <Segment startX="2" startY="-0.5" endX="2" endY="2.5" />
    <Segment startX="2" startY="2.5" endX="0" endY="3.5" />
    <Segment startX="6" startY="-8.5" endX="4" endY="-7.5" />
    <Segment startX="6" startY="-5.5" endX="8" endY="-4.5" />
    <Segment startX="4" startY="-4.5" endX="6" endY="-3.5" />
    <Segment startX="4" startY="-1.5" endX="6" endY="-0.5" />
    <Segment startX="2" startY="-0.5" endX="4" endY="0.5" />
    <Segment startX="2" startY="2.5" endX="4" endY="3.5" />
    <Segment startX="0" startY="3.5" endX="2" endY="4.5" />
    <Segment startX="-2" startY="4.5" endX="-2" endY="7.5" />
    <Segment startX="-2" startY="7.5" endX="0" endY="8.5" />
    <Segment startX="0" startY="6.5" endX="-2" endY="7.5" />
    <Segment startX="0" startY="3.5" endX="0" endY="6.5" />
    <Segment startX="0" startY="6.5" endX="2" endY="7.5" />
    <Segment startX="2" startY="7.5" endX="0" endY="8.5" />
    <Segment startX="2" startY="4.5" endX="2" endY="7.5" />
  </PathSegments>
  <Towers />
  <shuffleDeck>true</shuffleDeck>
  <premadeDeckName>Snipers</premadeDeckName>
</Level>