<?xml version="1.0" encoding="utf-8"?>
<Level xmlns:xsi="http://www.w3.org/2001/XMLSchema-instance" xmlns:xsd="http://www.w3.org/2001/XMLSchema" xsi:noNamespaceSchemaLocation="../Level.xsd" background="Black.png">
  <difficulty>medium</difficulty>  
  <description>Two symmetrical spirals.  The default level deck here contains no towers.</description>
  <randomWaveCount>14</randomWaveCount>
  <Waves>
    <Wave type="Standard" budget="116" time="1.1" />
  </Waves>
  <Spawners>
    <Spawner spawnX="0" spawnY="0" />
    <Spawner spawnX="0" spawnY="1" />
  </Spawners>
  <PathSegments>
    <Segment startX="0" startY="0" endX="0" endY="-1" />
    <Segment startX="0" startY="-1" endX="2" endY="-1" />
    <Segment startX="2" startY="-1" endX="2" endY="3" />
    <Segment startX="2" startY="3" endX="-8" endY="3" />
    <Segment startX="-8" startY="3" endX="-8" endY="-2" />
    <Segment startX="-8" startY="-2" endX="-4" endY="-2" />
    <Segment startX="-4" startY="-2" endX="-4" endY="2" />
    <Segment startX="-4" startY="2" endX="-7" endY="2" />
    <Segment startX="-7" startY="2" endX="-7" endY="-1" />
    <Segment startX="-7" startY="-1" endX="-5" endY="-1" />
    <Segment startX="-5" startY="-1" endX="-5" endY="1" />
    <Segment startX="-5" startY="1" endX="-6" endY="1" />
    <Segment startX="0" startY="1" endX="0" endY="2" />
    <Segment startX="0" startY="2" endX="-2" endY="2" />
    <Segment startX="-2" startY="2" endX="-2" endY="-2" />
    <Segment startX="-2" startY="-2" endX="8" endY="-2" />
    <Segment startX="8" startY="-2" endX="8" endY="3" />
    <Segment startX="8" startY="3" endX="4" endY="3" />
    <Segment startX="4" startY="3" endX="4" endY="-1" />
    <Segment startX="4" startY="-1" endX="7" endY="-1" />
    <Segment startX="7" startY="-1" endX="7" endY="2" />
    <Segment startX="7" startY="2" endX="5" endY="2" />
    <Segment startX="5" startY="2" endX="5" endY="0" />
    <Segment startX="5" startY="0" endX="6" endY="0" />
  </PathSegments>
  <Towers>
    <Tower name="Heavy Tower" x="-6.5" y="0.5" />
    <Tower name="Heavy Tower" x="-5.5" y="0.5" />
    <Tower name="Heavy Tower" x="-6.5" y="-0.5" />
    <Tower name="Heavy Tower" x="-5.5" y="-0.5" />
    <Tower name="Fast Tower" x="-6.5" y="0" />
    <Tower name="Fast Tower" x="-6" y="0.5" />
    <Tower name="Fast Tower" x="-6" y="-0.5" />
    <Tower name="Fast Tower" x="-5.5" y="0" />
    <Tower name="Basic Tower" x="-6" y="0" />
    <Tower name="Heavy Tower" x="6.5" y="1.5" />
    <Tower name="Heavy Tower" x="5.5" y="1.5" />
    <Tower name="Heavy Tower" x="6.5" y="0.5" />
    <Tower name="Heavy Tower" x="5.5" y="0.5" />
    <Tower name="Fast Tower" x="6.5" y="1" />
    <Tower name="Fast Tower" x="6" y="1.5" />
    <Tower name="Fast Tower" x="6" y="0.5" />
    <Tower name="Fast Tower" x="5.5" y="1" />
    <Tower name="Basic Tower" x="6" y="1" />
  </Towers>
  <shuffleDeck>true</shuffleDeck>
  <levelDeck name="Level Deck">
    <Cards>
      <Card name="Enrage" count="4" />
      <Card name="Fast Upgrade" count="10" />
      <Card name="Heavy Upgrade" count="10" />
      <Card name="Recycle" count="3" />
      <Card name="Shield" count="3" />
    </Cards>
  </levelDeck>
</Level>